{
  "schema_version": "t021.analysis.result.v1",
  "job_id": "job-module-001",
  "attempt_id": "attempt-module-000",
  "provider_type": "module",
  "provider_version": "module-rules-v1",
  "scene": {
    "type": "portrait",
    "lighting": "mixed"
  },
  "subjects": [
    {
      "type": "person",
      "priority": 1
    }
  ],
  "technical_findings": [
    {
      "code": "UNDEREXPOSED",
      "severity": 0.42
    },
    {
      "code": "NOISE_ELEVATED",
      "severity": 0.28
    }
  ],
  "color_findings": [
    {
      "code": "WARM_CAST",
      "severity": 0.18
    }
  ],
  "quality_risks": [
    "SHADOW_DETAIL_LOW"
  ],
  "confidence": 0.88,
  "created_at": "2026-06-22T00:00:00Z"
}
